e1:00.0 Class 0800: Device aaaa:bbbb
	Control: I/O- Mem- BusMaster- SpecCycle- MemWINV- VGASnoop- ParErr- Stepping- SERR- FastB2B- DisINTx-
	Status: Cap+ 66MHz- UDF- FastB2B- ParErr- DEVSEL=fast >TAbort- <TAbort- <MAbort- >SERR- <PERR- INTx-
	Interrupt: pin ? routed to IRQ 255
	Region 0: Memory at 20014000000 (64-bit, prefetchable) [disabled]
	Region 1: Memory at <unassigned> (32-bit, non-prefetchable) [disabled]
	Region 2: Memory at 20018013000 (64-bit, prefetchable) [disabled]
	Region 3: Memory at <unassigned> (32-bit, non-prefetchable) [disabled]
	Expansion ROM at dc2c0000 [disabled]
	Capabilities: [40] Power Management version 3
		Flags: PMEClk- DSI- D1+ D2- AuxCurrent=0mA PME(D0+,D1+,D2-,D3hot+,D3cold+)
		Status: D0 NoSoftRst+ PME-Enable- DSel=0 DScale=0 PME-
	Capabilities: [70] Express (v2) Endpoint, IntMsgNum 0
		DevCap:	MaxPayload 1024 bytes, PhantFunc 0, Latency L0s <64ns, L1 <1us
			ExtTag+ AttnBtn- AttnInd- PwrInd- RBE+ FLReset+ SlotPowerLimit 75W TEE-IO+
		DevCtl:	CorrErr+ NonFatalErr+ FatalErr+ UnsupReq-
			RlxdOrd+ ExtTag+ PhantFunc- AuxPwr- NoSnoop+ FLReset-
			MaxPayload 512 bytes, MaxReadReq 512 bytes
		DevSta:	CorrErr+ NonFatalErr- FatalErr- UnsupReq+ AuxPwr- TransPend-
		LnkCap:	Port #0, Speed 32GT/s, Width x16, ASPM not supported
			ClockPM- Surprise- LLActRep- BwNot- ASPMOptComp+
		LnkCtl:	ASPM Disabled; RCB 64 bytes, LnkDisable- CommClk+
			ExtSynch- ClockPM- AutWidDis- BWInt- AutBWInt-
		LnkSta:	Speed 32GT/s, Width x16
			TrErr- Train- SlotClk+ DLActive- BWMgmt- ABWMgmt-
		DevCap2: Completion Timeout: Not Supported, TimeoutDis+ NROPrPrP- LTR+
			 10BitTagComp+ 10BitTagReq+ OBFF Not Supported, ExtFmt+ EETLPPrefix+, MaxEETLPPrefixes 1
			 EmergencyPowerReduction Not Supported, EmergencyPowerReductionInit-
			 FRS- TPHComp- ExtTPHComp-
			 AtomicOpsCap: 32bit+ 64bit+ 128bitCAS+
		DevCtl2: Completion Timeout: 50us to 50ms, TimeoutDis-
			 AtomicOpsCtl: ReqEn-
			 IDOReq- IDOCompl- LTR+ EmergencyPowerReductionReq-
			 10BitTagReq+ OBFF Disabled, EETLPPrefixBlk-
		LnkCap2: Supported Link Speeds: 2.5-32GT/s, Crosslink- Retimer+ 2Retimers+ DRS-
		LnkCtl2: Target Link Speed: 32GT/s, EnterCompliance- SpeedDis-
			 Transmit Margin: Normal Operating Range, EnterModifiedCompliance- ComplianceSOS-
			 Compliance Preset/De-emphasis: -6dB de-emphasis, 0dB preshoot
		LnkSta2: Current De-emphasis Level: -6dB, EqualizationComplete+ EqualizationPhase1+
			 EqualizationPhase2+ EqualizationPhase3+ LinkEqualizationRequest-
			 Retimer- 2Retimers- CrosslinkRes: unsupported
	Capabilities: [100 v2] Advanced Error Reporting
		UESta:	DLP- SDES- TLP- FCP- CmpltTO- CmpltAbrt- UnxCmplt- RxOF- MalfTLP- ECRC- UnsupReq- ACSViol-
		UEMsk:	DLP- SDES- TLP- FCP- CmpltTO- CmpltAbrt- UnxCmplt- RxOF- MalfTLP- ECRC- UnsupReq- ACSViol-
		UESvrt:	DLP+ SDES+ TLP- FCP+ CmpltTO+ CmpltAbrt- UnxCmplt+ RxOF+ MalfTLP+ ECRC- UnsupReq- ACSViol-
		CESta:	RxErr- BadTLP- BadDLLP- Rollover- Timeout- AdvNonFatalErr+
		CEMsk:	RxErr- BadTLP- BadDLLP- Rollover- Timeout- AdvNonFatalErr+
		AERCap:	First Error Pointer: 00, ECRCGenCap- ECRCGenEn- ECRCChkCap- ECRCChkEn-
			MultHdrRecCap- MultHdrRecEn- TLPPfxPres- HdrLogCap-
		HeaderLog: 00000000 00000000 00000000 00000000
	Capabilities: [148 v1] Single Root I/O Virtualization (SR-IOV)
		IOVCap:	Migration- 10BitTagReq+ IntMsgNum 0
		IOVCtl:	Enable- Migration- Interrupt- MSE- ARIHierarchy+ 10BitTagReq-
		IOVSta:	Migration-
		Initial VFs: 4, Total VFs: 4, Number of VFs: 0, Function Dependency Link: 00
		VF offset: 32, stride: 1, Device ID: 50a5
		Supported Page Size: 00000553, System Page Size: 00000001
		Region 0: Memory at 000001fff8000000 (64-bit, prefetchable)
		Region 2: Memory at 000002001800c000 (64-bit, prefetchable)
		VF Migration: offset: 00000000, BIR: 0
	Capabilities: [188 v1] Alternative Routing-ID Interpretation (ARI)
		ARICap:	MFVC- ACS-, Next Function: 1
		ARICtl:	MFVC- ACS-, Function Group: 0
	Capabilities: [1c0 v1] Secondary PCI Express
		LnkCtl3: LnkEquIntrruptEn- PerformEqu-
		LaneErrStat: 0
	Capabilities: [3b0 v1] Physical Layer 16.0 GT/s <?>
	Capabilities: [400 v1] Lane Margining at the Receiver
		PortCap: Uses Driver-
		PortSta: MargReady+ MargSoftReady-
	Capabilities: [450 v1] Access Control Services
		ACSCap:	SrcValid- TransBlk- ReqRedir- CmpltRedir- UpstreamFwd- EgressCtrl- DirectTrans-
		ACSCtl:	SrcValid- TransBlk- ReqRedir- CmpltRedir- UpstreamFwd- EgressCtrl- DirectTrans-
	Capabilities: [460 v1] Physical Layer 32.0 GT/s <?>
	Capabilities: [5f0 v1] Process Address Space ID (PASID)
		PASIDCap: Exec+ Priv+, Max PASID Width: 10
		PASIDCtl: Enable+ Exec- Priv-
	Capabilities: [830 v1] Integrity & Data Encryption
		IDECap: Lnk=0 Sel=1 FlowThru- PartHdr- Aggr- PCPC- IDE_KM+ Alg='AES-GCM-256-96b' TCs=8 TeeLim+
		IDECtl: FTEn-
		SelectiveIDE#0 Cap: RID#=1
		SelectiveIDE#0 Ctl: En- NPR- PR- CPL- PCRC- HdrEnc=no Alg='AES-GCM-256-96b' TC0 ID0
		SelectiveIDE#0 Sta: insecure RecvChkFail-
		SelectiveIDE#0 RID: Valid- Base=0 Limit=0 SegBase=0
		SelectiveIDE#0 RID#0: Valid- Base=0 Limit=0
	Capabilities: [e00 v2] Data Object Exchange
		DOECap: IntSup-
		DOECtl: IntEn-
		DOESta: Busy- IntSta- Error- ObjectReady-
00: aa aa bb bb 00 00 10 00 00 00 00 08 10 00 80 00
10: 0c 00 00 14 00 02 00 00 0c 30 01 18 00 02 00 00
20: 00 00 00 00 00 00 00 00 00 00 00 00 00 00 00 00
30: 00 00 2c dc 40 00 00 00 00 00 00 00 ff 00 00 00
40: 01 70 03 da 08 00 00 00 05 70 80 00 00 00 00 00
50: 00 00 00 00 00 00 00 00 00 00 00 00 00 00 00 00
60: 11 70 00 00 40 00 00 00 50 00 00 00 00 00 00 00
70: 10 00 02 00 23 80 2c 51 57 29 09 00 05 f1 43 00
80: 40 00 05 11 00 00 00 00 00 00 00 00 00 00 00 00
90: 00 00 00 00 90 0b 73 00 00 14 00 00 3e 00 80 01
a0: 05 00 1e 00 00 00 00 00 00 00 00 00 00 00 00 00
b0: 00 00 00 00 00 00 00 00 00 00 00 00 00 00 00 00
c0: 00 00 00 00 00 00 00 00 00 00 00 00 00 00 00 00
d0: 00 00 00 00 00 00 00 00 00 00 00 00 00 00 00 00
e0: 00 00 00 00 00 00 00 00 00 00 00 00 00 00 00 00
f0: 00 00 00 00 00 00 00 00 00 00 00 00 00 00 00 00
100: 01 00 82 14 00 00 00 00 00 00 00 00 30 60 47 10
110: 00 20 00 00 00 20 00 00 00 00 00 00 00 00 00 00
120: 00 00 00 00 00 00 00 00 00 00 00 00 00 00 00 00
130: 00 00 00 00 00 00 00 00 00 00 00 00 00 00 00 00
140: 00 00 00 00 00 00 00 00 10 00 81 18 04 00 00 00
150: 10 00 00 00 04 00 04 00 00 00 00 00 20 00 01 00
160: 00 00 a5 50 53 05 00 00 01 00 00 00 0c 00 00 f8
170: ff 01 00 00 0c c0 00 18 00 02 00 00 00 00 00 00
180: 00 00 00 00 00 00 00 00 0e 00 01 1c 00 01 00 00
190: 00 00 00 00 00 00 00 00 00 00 00 00 00 00 00 00
1a0: 00 00 00 00 00 00 00 00 00 00 00 00 00 00 00 00
1b0: 00 00 00 00 00 00 00 00 00 00 00 00 00 00 00 00
1c0: 19 00 01 3b 00 00 00 00 00 00 00 00 00 75 00 79
1d0: 00 79 00 79 00 79 00 79 00 79 00 76 00 74 00 79
1e0: 00 79 00 79 00 79 00 79 00 79 00 79 00 00 00 00
1f0: 02 00 01 3a 00 00 00 00 00 00 00 00 00 00 00 00
200: 00 00 00 00 ff 00 00 80 00 00 00 00 00 00 00 00
210: 00 00 00 00 00 00 00 00 00 00 00 00 00 00 00 00
220: 00 00 00 00 00 00 00 00 00 00 00 00 00 00 00 00
230: 00 00 00 00 00 00 00 00 00 00 00 00 00 00 00 00
240: 00 00 00 00 00 00 00 00 00 00 00 00 00 00 00 00
250: 00 00 00 00 00 00 00 00 00 00 00 00 00 00 00 00
260: 00 00 00 00 00 00 00 00 00 00 00 00 00 00 00 00
270: 00 00 00 00 00 00 00 00 00 00 00 00 00 00 00 00
280: 00 00 00 00 00 00 00 00 00 00 00 00 00 00 00 00
290: 00 00 00 00 00 00 00 00 00 00 00 00 00 00 00 00
2a0: 00 00 00 00 00 00 00 00 00 00 00 00 00 00 00 00
2b0: 00 00 00 00 00 00 00 00 00 00 00 00 00 00 00 00
2c0: 00 00 00 00 00 00 00 00 00 00 00 00 00 00 00 00
2d0: 00 00 00 00 00 00 00 00 00 00 00 00 00 00 00 00
2e0: 00 00 00 00 00 00 00 00 00 00 00 00 00 00 00 00
2f0: 00 00 00 00 00 00 00 00 00 00 00 00 00 00 00 00
300: 00 00 00 00 00 00 00 00 00 00 00 00 00 00 00 00
310: 00 00 00 00 00 00 00 00 00 00 00 00 00 00 00 00
320: 00 00 00 00 00 00 00 00 00 00 00 00 00 00 00 00
330: 00 00 00 00 00 00 00 00 00 00 00 00 00 00 00 00
340: 00 00 00 00 00 00 00 00 00 00 00 00 00 00 00 00
350: 00 00 00 00 00 00 00 00 00 00 00 00 00 00 00 00
360: 00 00 00 00 00 00 00 00 00 00 00 00 00 00 00 00
370: 00 00 00 00 00 00 00 00 00 00 00 00 00 00 00 00
380: 00 00 00 00 00 00 00 00 00 00 00 00 00 00 00 00
390: 00 00 00 00 00 00 00 00 00 00 00 00 00 00 00 00
3a0: 25 00 01 3b 01 00 00 80 01 00 00 80 00 00 00 00
3b0: 26 00 01 40 00 00 00 00 00 00 00 00 0f 00 00 00
3c0: 00 00 00 00 00 00 00 00 00 00 00 00 00 00 00 00
3d0: 40 40 50 40 40 40 40 50 40 50 40 40 40 40 40 40
3e0: 00 00 00 00 00 00 00 00 00 00 00 00 00 00 00 00
3f0: 00 00 00 00 00 00 00 00 00 00 00 00 00 00 00 00
400: 27 00 01 45 00 00 01 00 38 9c 00 00 38 9c 00 00
410: 38 9c 00 00 38 9c 00 00 38 9c 00 00 38 9c 00 00
420: 38 9c 00 00 38 9c 00 00 38 9c 00 00 38 9c 00 00
430: 38 9c 00 00 38 9c 00 00 38 9c 00 00 38 9c 00 00
440: 38 9c 00 00 38 9c 00 00 00 00 00 00 00 00 00 00
450: 0d 00 01 46 00 00 00 00 00 00 00 00 00 00 00 00
460: 2a 00 01 5f 00 01 00 00 00 00 00 00 0f 00 00 00
470: 00 00 00 00 00 00 00 00 00 00 00 00 00 00 00 00
480: 40 40 40 60 60 50 50 50 50 50 50 60 50 50 60 50
490: 00 00 00 00 00 00 00 00 00 00 00 00 00 00 00 00
4a0: 00 00 00 00 00 00 00 00 00 00 00 00 00 00 00 00
4b0: 00 00 00 00 00 00 00 00 00 00 00 00 00 00 00 00
4c0: 00 00 00 00 00 00 00 00 00 00 00 00 00 00 00 00
4d0: 00 00 00 00 00 00 00 00 00 00 00 00 00 00 00 00
4e0: 00 00 00 00 00 00 00 00 00 00 00 00 00 00 00 00
4f0: 00 00 00 00 00 00 00 00 00 00 00 00 00 00 00 00
500: 00 00 00 00 00 00 00 00 00 00 00 00 00 00 00 00
510: 00 00 00 00 00 00 00 00 00 00 00 00 00 00 00 00
520: 00 00 00 00 00 00 00 00 00 00 00 00 00 00 00 00
530: 00 00 00 00 00 00 00 00 00 00 00 00 00 00 00 00
540: 00 00 00 00 00 00 00 00 00 00 00 00 00 00 00 00
550: 00 00 00 00 00 00 00 00 00 00 00 00 00 00 00 00
560: 00 00 00 00 00 00 00 00 00 00 00 00 00 00 00 00
570: 00 00 00 00 00 00 00 00 00 00 00 00 00 00 00 00
580: 00 00 00 00 00 00 00 00 00 00 00 00 00 00 00 00
590: 00 00 00 00 00 00 00 00 00 00 00 00 00 00 00 00
5a0: 00 00 00 00 00 00 00 00 00 00 00 00 00 00 00 00
5b0: 00 00 00 00 00 00 00 00 00 00 00 00 00 00 00 00
5c0: 00 00 00 00 00 00 00 00 00 00 00 00 00 00 00 00
5d0: 00 00 00 00 00 00 00 00 00 00 00 00 00 00 00 00
5e0: 00 00 00 00 00 00 00 00 00 00 00 00 00 00 00 00
5f0: 1b 00 01 83 06 10 01 00 00 00 00 00 00 00 00 00
600: 00 00 00 00 00 00 00 00 00 00 00 00 00 00 00 00
610: 00 00 00 00 00 00 00 00 00 00 00 00 00 00 00 00
620: 00 00 00 00 00 00 00 00 00 00 00 00 00 00 00 00
630: 00 00 00 00 00 00 00 00 00 00 00 00 00 00 00 00
640: 00 00 00 00 00 00 00 00 00 00 00 00 00 00 00 00
650: 00 00 00 00 00 00 00 00 00 00 00 00 00 00 00 00
660: 00 00 00 00 00 00 00 00 00 00 00 00 00 00 00 00
670: 00 00 00 00 00 00 00 00 00 00 00 00 00 00 00 00
680: 00 00 00 00 00 00 00 00 00 00 00 00 00 00 00 00
690: 00 00 00 00 00 00 00 00 00 00 00 00 00 00 00 00
6a0: 00 00 00 00 00 00 00 00 00 00 00 00 00 00 00 00
6b0: 00 00 00 00 00 00 00 00 00 00 00 00 00 00 00 00
6c0: 00 00 00 00 00 00 00 00 00 00 00 00 00 00 00 00
6d0: 00 00 00 00 00 00 00 00 00 00 00 00 00 00 00 00
6e0: 00 00 00 00 00 00 00 00 00 00 00 00 00 00 00 00
6f0: 00 00 00 00 00 00 00 00 00 00 00 00 00 00 00 00
700: 00 00 00 00 00 00 00 00 00 00 00 00 00 00 00 00
710: 00 00 00 00 00 00 00 00 00 00 00 00 00 00 00 00
720: 00 00 00 00 00 00 00 00 00 00 00 00 00 00 00 00
730: 00 00 00 00 00 00 00 00 00 00 00 00 00 00 00 00
740: 00 00 00 00 00 00 00 00 00 00 00 00 00 00 00 00
750: 00 00 00 00 00 00 00 00 00 00 00 00 00 00 00 00
760: 00 00 00 00 00 00 00 00 00 00 00 00 00 00 00 00
770: 00 00 00 00 00 00 00 00 00 00 00 00 00 00 00 00
780: 00 00 00 00 00 00 00 00 00 00 00 00 00 00 00 00
790: 00 00 00 00 00 00 00 00 00 00 00 00 00 00 00 00
7a0: 00 00 00 00 00 00 00 00 00 00 00 00 00 00 00 00
7b0: 00 00 00 00 00 00 00 00 00 00 00 00 00 00 00 00
7c0: 00 00 00 00 00 00 00 00 00 00 00 00 00 00 00 00
7d0: 00 00 00 00 00 00 00 00 00 00 00 00 00 00 00 00
7e0: 00 00 00 00 00 00 00 00 00 00 00 00 00 00 00 00
7f0: 00 00 00 00 00 00 00 00 00 00 00 00 00 00 00 00
800: 00 00 00 00 00 00 00 00 00 00 00 00 00 00 00 00
810: 00 00 00 00 00 00 00 00 00 00 00 00 00 00 00 00
820: 00 00 00 00 00 00 00 00 00 00 00 00 00 00 00 00
830: 30 00 01 e0 42 e0 00 01 00 00 00 00 01 00 00 00
840: 00 00 00 00 00 00 00 00 00 00 00 00 00 00 00 00
850: 00 00 00 00 00 00 00 00 00 00 00 00 00 00 00 00
860: 00 00 00 00 00 00 00 00 00 00 00 00 00 00 00 00
870: 00 00 00 00 00 00 00 00 00 00 00 00 00 00 00 00
880: 00 00 00 00 00 00 00 00 00 00 00 00 00 00 00 00
890: 00 00 00 00 00 00 00 00 00 00 00 00 00 00 00 00
8a0: 00 00 00 00 00 00 00 00 00 00 00 00 00 00 00 00
8b0: 00 00 00 00 00 00 00 00 00 00 00 00 00 00 00 00
8c0: 00 00 00 00 00 00 00 00 00 00 00 00 00 00 00 00
8d0: 00 00 00 00 00 00 00 00 00 00 00 00 00 00 00 00
8e0: 00 00 00 00 00 00 00 00 00 00 00 00 00 00 00 00
8f0: 00 00 00 00 00 00 00 00 00 00 00 00 00 00 00 00
900: 00 00 00 00 00 00 00 00 00 00 00 00 00 00 00 00
910: 00 00 00 00 00 00 00 00 00 00 00 00 00 00 00 00
920: 00 00 00 00 00 00 00 00 00 00 00 00 00 00 00 00
930: 00 00 00 00 00 00 00 00 00 00 00 00 00 00 00 00
940: 00 00 00 00 00 00 00 00 00 00 00 00 00 00 00 00
950: 00 00 00 00 00 00 00 00 00 00 00 00 00 00 00 00
960: 00 00 00 00 00 00 00 00 00 00 00 00 00 00 00 00
970: 00 00 00 00 00 00 00 00 00 00 00 00 00 00 00 00
980: 00 00 00 00 00 00 00 00 00 00 00 00 00 00 00 00
990: 00 00 00 00 00 00 00 00 00 00 00 00 00 00 00 00
9a0: 00 00 00 00 00 00 00 00 00 00 00 00 00 00 00 00
9b0: 00 00 00 00 00 00 00 00 00 00 00 00 00 00 00 00
9c0: 00 00 00 00 00 00 00 00 00 00 00 00 00 00 00 00
9d0: 00 00 00 00 00 00 00 00 00 00 00 00 00 00 00 00
9e0: 00 00 00 00 00 00 00 00 00 00 00 00 00 00 00 00
9f0: 00 00 00 00 00 00 00 00 00 00 00 00 00 00 00 00
a00: 00 00 00 00 00 00 00 00 00 00 00 00 00 00 00 00
a10: 00 00 00 00 00 00 00 00 00 00 00 00 00 00 00 00
a20: 00 00 00 00 00 00 00 00 00 00 00 00 00 00 00 00
a30: 00 00 00 00 00 00 00 00 00 00 00 00 00 00 00 00
a40: 00 00 00 00 00 00 00 00 00 00 00 00 00 00 00 00
a50: 00 00 00 00 00 00 00 00 00 00 00 00 00 00 00 00
a60: 00 00 00 00 00 00 00 00 00 00 00 00 00 00 00 00
a70: 00 00 00 00 00 00 00 00 00 00 00 00 00 00 00 00
a80: 00 00 00 00 00 00 00 00 00 00 00 00 00 00 00 00
a90: 00 00 00 00 00 00 00 00 00 00 00 00 00 00 00 00
aa0: 00 00 00 00 00 00 00 00 00 00 00 00 00 00 00 00
ab0: 00 00 00 00 00 00 00 00 00 00 00 00 00 00 00 00
ac0: 00 00 00 00 00 00 00 00 00 00 00 00 00 00 00 00
ad0: 00 00 00 00 00 00 00 00 00 00 00 00 00 00 00 00
ae0: 00 00 00 00 00 00 00 00 00 00 00 00 00 00 00 00
af0: 00 00 00 00 00 00 00 00 00 00 00 00 00 00 00 00
b00: 00 00 00 00 00 00 00 00 00 00 00 00 00 00 00 00
b10: 00 00 00 00 00 00 00 00 00 00 00 00 00 00 00 00
b20: 00 00 00 00 00 00 00 00 00 00 00 00 00 00 00 00
b30: 00 00 00 00 00 00 00 00 00 00 00 00 00 00 00 00
b40: 00 00 00 00 00 00 00 00 00 00 00 00 00 00 00 00
b50: 00 00 00 00 00 00 00 00 00 00 00 00 00 00 00 00
b60: 00 00 00 00 00 00 00 00 00 00 00 00 00 00 00 00
b70: 00 00 00 00 00 00 00 00 00 00 00 00 00 00 00 00
b80: 00 00 00 00 00 00 00 00 00 00 00 00 00 00 00 00
b90: 00 00 00 00 00 00 00 00 00 00 00 00 00 00 00 00
ba0: 00 00 00 00 00 00 00 00 00 00 00 00 00 00 00 00
bb0: 00 00 00 00 00 00 00 00 00 00 00 00 00 00 00 00
bc0: 00 00 00 00 00 00 00 00 00 00 00 00 00 00 00 00
bd0: 00 00 00 00 00 00 00 00 00 00 00 00 00 00 00 00
be0: 00 00 00 00 00 00 00 00 00 00 00 00 00 00 00 00
bf0: 00 00 00 00 00 00 00 00 00 00 00 00 00 00 00 00
c00: 00 00 00 00 00 00 00 00 00 00 00 00 00 00 00 00
c10: 00 00 00 00 00 00 00 00 00 00 00 00 00 00 00 00
c20: 00 00 00 00 00 00 00 00 00 00 00 00 00 00 00 00
c30: 00 00 00 00 00 00 00 00 00 00 00 00 00 00 00 00
c40: 00 00 00 00 00 00 00 00 00 00 00 00 00 00 00 00
c50: 00 00 00 00 00 00 00 00 00 00 00 00 00 00 00 00
c60: 00 00 00 00 00 00 00 00 00 00 00 00 00 00 00 00
c70: 00 00 00 00 00 00 00 00 00 00 00 00 00 00 00 00
c80: 00 00 00 00 00 00 00 00 00 00 00 00 00 00 00 00
c90: 00 00 00 00 00 00 00 00 00 00 00 00 00 00 00 00
ca0: 00 00 00 00 00 00 00 00 00 00 00 00 00 00 00 00
cb0: 00 00 00 00 00 00 00 00 00 00 00 00 00 00 00 00
cc0: 00 00 00 00 00 00 00 00 00 00 00 00 00 00 00 00
cd0: 00 00 00 00 00 00 00 00 00 00 00 00 00 00 00 00
ce0: 00 00 00 00 00 00 00 00 00 00 00 00 00 00 00 00
cf0: 00 00 00 00 00 00 00 00 00 00 00 00 00 00 00 00
d00: 00 00 00 00 00 00 00 00 00 00 00 00 00 00 00 00
d10: 00 00 00 00 00 00 00 00 00 00 00 00 00 00 00 00
d20: 00 00 00 00 00 00 00 00 00 00 00 00 00 00 00 00
d30: 00 00 00 00 00 00 00 00 00 00 00 00 00 00 00 00
d40: 00 00 00 00 00 00 00 00 00 00 00 00 00 00 00 00
d50: 00 00 00 00 00 00 00 00 00 00 00 00 00 00 00 00
d60: 00 00 00 00 00 00 00 00 00 00 00 00 00 00 00 00
d70: 00 00 00 00 00 00 00 00 00 00 00 00 00 00 00 00
d80: 00 00 00 00 00 00 00 00 00 00 00 00 00 00 00 00
d90: 00 00 00 00 00 00 00 00 00 00 00 00 00 00 00 00
da0: 00 00 00 00 00 00 00 00 00 00 00 00 00 00 00 00
db0: 00 00 00 00 00 00 00 00 00 00 00 00 00 00 00 00
dc0: 00 00 00 00 00 00 00 00 00 00 00 00 00 00 00 00
dd0: 00 00 00 00 00 00 00 00 00 00 00 00 00 00 00 00
de0: 00 00 00 00 00 00 00 00 00 00 00 00 00 00 00 00
df0: 00 00 00 00 00 00 00 00 00 00 00 00 00 00 00 00
e00: 2e 00 02 00 00 00 00 00 00 00 00 00 00 00 00 00
e10: 00 00 00 00 00 00 00 00 00 00 00 00 00 00 00 00
e20: 00 00 00 00 00 00 00 00 00 00 00 00 00 00 00 00
e30: 00 00 00 00 00 00 00 00 00 00 00 00 00 00 00 00
e40: 00 00 00 00 00 00 00 00 00 00 00 00 00 00 00 00
e50: 00 00 00 00 00 00 00 00 00 00 00 00 00 00 00 00
e60: 00 00 00 00 00 00 00 00 00 00 00 00 00 00 00 00
e70: 00 00 00 00 00 00 00 00 00 00 00 00 00 00 00 00
e80: 00 00 00 00 00 00 00 00 00 00 00 00 00 00 00 00
e90: 00 00 00 00 00 00 00 00 00 00 00 00 00 00 00 00
ea0: 00 00 00 00 00 00 00 00 00 00 00 00 00 00 00 00
eb0: 00 00 00 00 00 00 00 00 00 00 00 00 00 00 00 00
ec0: 00 00 00 00 00 00 00 00 00 00 00 00 00 00 00 00
ed0: 00 00 00 00 00 00 00 00 00 00 00 00 00 00 00 00
ee0: 00 00 00 00 00 00 00 00 00 00 00 00 00 00 00 00
ef0: 00 00 00 00 00 00 00 00 00 00 00 00 00 00 00 00
f00: 00 00 00 00 00 00 00 00 00 00 00 00 00 00 00 00
f10: 00 00 00 00 00 00 00 00 00 00 00 00 00 00 00 00
f20: 00 00 00 00 00 00 00 00 00 00 00 00 00 00 00 00
f30: 00 00 00 00 00 00 00 00 00 00 00 00 00 00 00 00
f40: 00 00 00 00 00 00 00 00 00 00 00 00 00 00 00 00
f50: 00 00 00 00 00 00 00 00 00 00 00 00 00 00 00 00
f60: 00 00 00 00 00 00 00 00 00 00 00 00 00 00 00 00
f70: 00 00 00 00 00 00 00 00 00 00 00 00 00 00 00 00
f80: 00 00 00 00 00 00 00 00 00 00 00 00 00 00 00 00
f90: 00 00 00 00 00 00 00 00 00 00 00 00 00 00 00 00
fa0: 00 00 00 00 00 00 00 00 00 00 00 00 00 00 00 00
fb0: 00 00 00 00 00 00 00 00 00 00 00 00 00 00 00 00
fc0: 00 00 00 00 00 00 00 00 00 00 00 00 00 00 00 00
fd0: 00 00 00 00 00 00 00 00 00 00 00 00 00 00 00 00
fe0: 00 00 00 00 00 00 00 00 00 00 00 00 00 00 00 00
ff0: 00 00 00 00 00 00 00 00 00 00 00 00 00 00 00 00

